{
  "request_id": "APR-20260313-0001",
  "action_type": "script_execution",
  "timestamp": "2026-03-13T12:00:00Z",
  "agent": "orchestrator",
  "machine": "main",
  "target": "E:/Repos/my-repo/scripts/new_script.py",
  "reason": "One-time migration script; no existing tool in registry",
  "diff_preview": "N/A — new file",
  "risk_level": "low",
  "scope_repo": "my-repo",
  "approval_tier": "T2",
  "status": "pending"
}
